{
  "id": "apidep_entity_000006",
  "slug": "aws-sdk-javascript-v2",
  "canonical_name": "AWS SDK for JavaScript v2",
  "aliases": ["AWS SDK for JavaScript (v2)", "aws-sdk v2"],
  "provider": "AWS",
  "provider_id": null,
  "category": "developer_tool_api",
  "record_unit": "sdk",
  "status": "deprecated",
  "deprecation_stage": "deprecated",
  "deadline_status": "passed_unverified",
  "still_usable": "yes",
  "still_usable_note": "AWS states that existing applications can continue to function, but v2 reached end-of-support and no longer receives updates or releases.",
  "action_required": "migrate",
  "impact_level": "high",
  "production_risk": "high",
  "freshness_status": "fresh",
  "summary": "AWS SDK for JavaScript v2 reached end-of-support on September 8, 2025. AWS recommends migration to v3 while published v2 releases remain available.",
  "current_state": "End-of-support has passed. Published v2 releases remain available, but AWS no longer provides updates or releases and recommends v3.",
  "affected_surface": ["sdk"],
  "affected_users": ["developers", "api_integrators"],
  "official_url": "https://aws.amazon.com/blogs/developer/announcing-end-of-support-for-aws-sdk-for-javascript-v2/",
  "docs_url": "https://docs.aws.amazon.com/sdk-for-javascript/v2/developer-guide/",
  "migration_url": "https://aws.amazon.com/blogs/developer/announcing-end-of-support-for-aws-sdk-for-javascript-v2/",
  "replacement": "AWS SDK for JavaScript v3",
  "replacement_type": "official",
  "replacement_url": "https://aws.amazon.com/blogs/developer/announcing-end-of-support-for-aws-sdk-for-javascript-v2/",
  "source_status": "official",
  "confidence": "high",
  "announced_at": "2024-03-06",
  "deprecated_at": "2024-09-08",
  "sunset_at": "2025-09-08",
  "last_supported_at": "2025-09-08",
  "removal_effective_at": null,
  "migration_deadline_at": "2025-09-08",
  "first_seen_at": "2026-06-07",
  "last_checked_at": "2026-08-19",
  "next_check_recommended_at": null,
  "known_unknowns": ["End-of-support is not the same as runtime removal; already-published v2 releases remain available."],
  "related_records": [],
  "notes": "Canonical backfill from current first-party AWS lifecycle documentation."
}