{
  "id": "apidep_entity_000010",
  "slug": "azure-ad-graph-api",
  "canonical_name": "Azure AD Graph API",
  "aliases": ["Azure Active Directory Graph API", "Azure AD Graph"],
  "provider": "Microsoft",
  "provider_id": null,
  "category": "cloud_hosting_api",
  "record_unit": "api_group",
  "status": "removed",
  "deprecation_stage": "removed",
  "deadline_status": "passed_removed",
  "still_usable": "no",
  "still_usable_note": "Microsoft states that extended access ended on August 31, 2025 and Azure AD Graph is fully retired.",
  "action_required": "migrate",
  "impact_level": "high",
  "production_risk": "critical",
  "freshness_status": "fresh",
  "summary": "Azure AD Graph completed retirement on August 31, 2025 after an extended-access period. Microsoft directs integrations to Microsoft Graph.",
  "current_state": "Fully retired according to current Microsoft migration documentation; Microsoft Graph is the supported replacement surface.",
  "affected_surface": ["api_version"],
  "affected_users": ["developers", "api_integrators", "identity_administrators"],
  "official_url": "https://learn.microsoft.com/en-us/graph/migrate-azure-ad-graph-overview",
  "docs_url": "https://learn.microsoft.com/en-us/graph/migrate-azure-ad-graph-overview",
  "migration_url": "https://learn.microsoft.com/en-us/graph/migrate-azure-ad-graph-overview",
  "replacement": "Microsoft Graph",
  "replacement_type": "official",
  "replacement_url": "https://learn.microsoft.com/en-us/graph/migrate-azure-ad-graph-overview",
  "source_status": "official",
  "confidence": "high",
  "announced_at": null,
  "deprecated_at": null,
  "sunset_at": "2025-08-31",
  "last_supported_at": "2025-08-31",
  "removal_effective_at": "2025-08-31",
  "migration_deadline_at": "2025-08-31",
  "first_seen_at": "2026-06-07",
  "last_checked_at": "2026-08-20",
  "next_check_recommended_at": null,
  "known_unknowns": ["The repository does not currently pin the exact calendar date of Microsoft's first 2019 deprecation announcement, so structured announcement/deprecation dates remain unknown."],
  "related_records": [],
  "notes": "Corrects the older display state that treated August 31, 2026 as an upcoming boundary."
}