{
  "id": "apidep_entity_000019",
  "slug": "google-container-registry",
  "canonical_name": "Google Container Registry",
  "aliases": ["Container Registry", "GCR"],
  "provider": "Google Cloud",
  "provider_id": null,
  "category": "cloud_hosting_api",
  "record_unit": "developer_feature",
  "status": "removed",
  "deprecation_stage": "removed",
  "deadline_status": "passed_removed",
  "still_usable": "no",
  "still_usable_note": "Google Cloud states that Container Registry is shut down effective March 18, 2025 and writing images to Container Registry is unavailable. Artifact Registry-backed gcr.io URLs are a separate supported path.",
  "action_required": "migrate",
  "impact_level": "high",
  "production_risk": "critical",
  "freshness_status": "fresh",
  "summary": "Google Cloud shut down Container Registry on March 18, 2025 and recommends Artifact Registry for container image storage and management.",
  "current_state": "Container Registry itself is shut down. Artifact Registry can serve compatible gcr.io repositories, which must not be mistaken for continued Container Registry operation.",
  "affected_surface": ["api_version"],
  "affected_users": ["developers", "devops_operators", "container_registry_users"],
  "official_url": "https://docs.cloud.google.com/artifact-registry/docs/transition/transition-from-gcr",
  "docs_url": "https://docs.cloud.google.com/artifact-registry/docs/transition/transition-from-gcr",
  "migration_url": "https://docs.cloud.google.com/artifact-registry/docs/transition/transition-from-gcr",
  "replacement": "Artifact Registry",
  "replacement_type": "official",
  "replacement_url": "https://docs.cloud.google.com/artifact-registry/docs/transition/transition-from-gcr",
  "source_status": "official",
  "confidence": "high",
  "announced_at": null,
  "deprecated_at": null,
  "sunset_at": "2025-03-18",
  "last_supported_at": "2025-03-18",
  "removal_effective_at": "2025-03-18",
  "migration_deadline_at": "2025-03-18",
  "first_seen_at": "2026-06-08",
  "last_checked_at": "2026-08-20",
  "next_check_recommended_at": null,
  "known_unknowns": [],
  "related_records": [],
  "notes": "The continuing gcr.io namespace can be backed by Artifact Registry and is not evidence that Container Registry remains active."
}