{
  "id": "apidep_entity_000012",
  "slug": "dropbox-api-v1",
  "canonical_name": "Dropbox API v1",
  "aliases": ["Dropbox Core API v1", "Dropbox Business API v1"],
  "provider": "Dropbox",
  "provider_id": null,
  "category": "developer_tool_api",
  "record_unit": "api_version",
  "status": "removed",
  "deprecation_stage": "removed",
  "deadline_status": "passed_removed",
  "still_usable": "no",
  "still_usable_note": "Dropbox states that API v1 endpoints were turned off on September 28, 2017.",
  "action_required": "migrate",
  "impact_level": "high",
  "production_risk": "critical",
  "freshness_status": "fresh",
  "summary": "Dropbox API v1 was deprecated in 2016 and its endpoints were turned off on September 28, 2017. Dropbox API v2 is the supported migration target.",
  "current_state": "Removed. Calls to retired v1 endpoints are no longer supported and integrations must use Dropbox API v2.",
  "affected_surface": ["api_version"],
  "affected_users": ["developers", "api_integrators"],
  "official_url": "https://dropbox.tech/developers/api-v1-shutdown-details",
  "docs_url": "https://dropbox.tech/developers/api-v1-shutdown-details",
  "migration_url": "https://dropbox.tech/developers/announcing-the-v1-to-v2-migration-guide",
  "replacement": "Dropbox API v2",
  "replacement_type": "official",
  "replacement_url": "https://dropbox.tech/developers/announcing-the-v1-to-v2-migration-guide",
  "source_status": "official",
  "confidence": "high",
  "announced_at": "2016-06-28",
  "deprecated_at": "2016-06-28",
  "sunset_at": "2017-09-28",
  "last_supported_at": "2017-09-28",
  "removal_effective_at": "2017-09-28",
  "migration_deadline_at": "2017-09-28",
  "first_seen_at": "2026-06-08",
  "last_checked_at": "2026-08-20",
  "next_check_recommended_at": null,
  "known_unknowns": [],
  "related_records": [],
  "notes": "Corrects the display timeline that had used the 2026 review date as if it were the removal event date."
}