{
  "id": "apidep_entity_000018",
  "slug": "exchange-online-basic-authentication",
  "canonical_name": "Exchange Online Basic authentication",
  "aliases": ["Exchange Online Basic Auth", "Exchange Online legacy authentication"],
  "provider": "Microsoft",
  "provider_id": null,
  "category": "cloud_hosting_api",
  "record_unit": "auth_method",
  "status": "replaced",
  "deprecation_stage": "removed",
  "deadline_status": "passed_unverified",
  "still_usable": "no",
  "still_usable_note": "Microsoft states that Basic authentication is now disabled in all tenants for the affected Exchange Online protocols. Disablement was phased, so this record does not invent one universal final-completion date.",
  "action_required": "rotate_auth",
  "impact_level": "high",
  "production_risk": "critical",
  "freshness_status": "fresh",
  "summary": "Microsoft removed Basic authentication from affected Exchange Online protocols and requires Modern authentication/OAuth-based access instead.",
  "current_state": "Basic authentication is disabled in all tenants for the affected protocols; applications must use Modern authentication or another supported method.",
  "affected_surface": ["auth"],
  "affected_users": ["developers", "api_integrators", "exchange_administrators"],
  "official_url": "https://learn.microsoft.com/en-us/exchange/clients-and-mobile-in-exchange-online/deprecation-of-basic-authentication-exchange-online",
  "docs_url": "https://learn.microsoft.com/en-us/exchange/clients-and-mobile-in-exchange-online/deprecation-of-basic-authentication-exchange-online",
  "migration_url": "https://learn.microsoft.com/en-us/exchange/client-developer/exchange-server-development",
  "replacement": "Modern authentication (OAuth 2.0)",
  "replacement_type": "official",
  "replacement_url": "https://learn.microsoft.com/en-us/exchange/client-developer/exchange-server-development",
  "source_status": "official",
  "confidence": "high",
  "announced_at": "2019-09-20",
  "deprecated_at": null,
  "sunset_at": "2022-10-01",
  "last_supported_at": null,
  "removal_effective_at": null,
  "migration_deadline_at": "2022-10-01",
  "first_seen_at": "2026-06-08",
  "last_checked_at": "2026-08-20",
  "next_check_recommended_at": null,
  "known_unknowns": ["The service-wide disablement was phased across tenants and cloud environments, so October 1, 2022 is recorded as the main rollout boundary rather than a fabricated universal completion date."],
  "related_records": [],
  "notes": "Current Microsoft documentation confirms the present all-tenants disabled state."
}