{
  "id": "apidep_entity_000016",
  "slug": "fcm-legacy-http-xmpp-apis",
  "canonical_name": "FCM legacy HTTP and XMPP APIs",
  "aliases": ["Firebase Cloud Messaging legacy HTTP API", "FCM legacy XMPP API"],
  "provider": "Firebase",
  "provider_id": null,
  "category": "cloud_hosting_api",
  "record_unit": "api_group",
  "status": "replaced",
  "deprecation_stage": "removed",
  "deadline_status": "passed_unverified",
  "still_usable": "no",
  "still_usable_note": "Firebase documents the legacy HTTP/XMPP sending APIs as deprecated with shutdown beginning July 22, 2024, while current Firebase references describe legacy upstream messaging as decommissioned. The exact date on which every legacy path became unavailable is not inferred.",
  "action_required": "migrate",
  "impact_level": "high",
  "production_risk": "critical",
  "freshness_status": "fresh",
  "summary": "Firebase replaced the legacy FCM HTTP/XMPP sending APIs with the HTTP v1 API. Deprecation took effect June 20, 2023 and shutdown began July 22, 2024.",
  "current_state": "Legacy FCM sending paths are no longer the supported interface; HTTP v1 is the supported migration target.",
  "affected_surface": ["endpoint"],
  "affected_users": ["developers", "api_integrators", "push_notification_operators"],
  "official_url": "https://firebase.google.cn/docs/cloud-messaging/migrate-v1?hl=zh-tw",
  "docs_url": "https://firebase.google.com/docs/cloud-messaging/send/v1-api",
  "migration_url": "https://firebase.google.cn/docs/cloud-messaging/migrate-v1?hl=zh-tw",
  "replacement": "FCM HTTP v1 API",
  "replacement_type": "official",
  "replacement_url": "https://firebase.google.com/docs/cloud-messaging/send/v1-api",
  "source_status": "official",
  "confidence": "high",
  "announced_at": null,
  "deprecated_at": "2023-06-20",
  "sunset_at": "2024-07-22",
  "last_supported_at": null,
  "removal_effective_at": null,
  "migration_deadline_at": "2024-07-22",
  "first_seen_at": "2026-06-08",
  "last_checked_at": "2026-08-20",
  "next_check_recommended_at": null,
  "known_unknowns": ["July 22, 2024 is documented as the start of shutdown, not necessarily the exact completion date for every legacy path."],
  "related_records": [],
  "notes": "Avoids converting the documented shutdown-start date into an unsupported universal completion date."
}