{
  "id": "apidep_entity_000001",
  "slug": "google-palm-api",
  "canonical_name": "Google PaLM API",
  "aliases": ["PaLM API"],
  "provider": "Google AI",
  "provider_id": "apidep_provider_000006",
  "category": "ai_api",
  "record_unit": "model_api",
  "status": "removed",
  "deprecation_stage": "removed",
  "deadline_status": "passed_removed",
  "still_usable": "no",
  "still_usable_note": "Official documentation lists decommissioning as of August 15, 2024.",
  "action_required": "migrate",
  "impact_level": "high",
  "production_risk": "critical",
  "freshness_status": "fresh",
  "summary": "AI API sample record with official replacement guidance.",
  "current_state": "Removed according to official documentation.",
  "affected_surface": ["model"],
  "affected_users": ["developers", "api_integrators"],
  "official_url": "https://ai.google.dev/palm_docs/deprecation",
  "docs_url": "https://ai.google.dev/palm_docs/deprecation",
  "migration_url": "https://ai.google.dev/palm_docs/deprecation",
  "replacement": "Gemini API",
  "replacement_type": "official",
  "replacement_url": "https://ai.google.dev/palm_docs/deprecation",
  "source_status": "official",
  "confidence": "high",
  "announced_at": null,
  "deprecated_at": null,
  "sunset_at": null,
  "last_supported_at": "2024-08-15",
  "removal_effective_at": "2024-08-15",
  "migration_deadline_at": "2024-08-15",
  "first_seen_at": "2026-06-05",
  "last_checked_at": "2026-08-20",
  "next_check_recommended_at": "2027-02-20",
  "known_unknowns": [],
  "related_records": [],
  "notes": "Stage 7 first-party follow-up reconfirmed decommissioned state and Gemini migration path on 2026-08-20."
}
