{
  "id": "apidep_entity_000011",
  "slug": "google-cloud-iot-core",
  "canonical_name": "Google Cloud IoT Core",
  "aliases": ["Cloud IoT Core", "Google Cloud IoT"],
  "provider": "Google Cloud",
  "provider_id": null,
  "category": "cloud_hosting_api",
  "record_unit": "api_group",
  "status": "removed",
  "deprecation_stage": "removed",
  "deadline_status": "passed_removed",
  "still_usable": "no",
  "still_usable_note": "Google Cloud documentation identifies August 16, 2023 as the discontinuation boundary for IoT Core.",
  "action_required": "migrate",
  "impact_level": "high",
  "production_risk": "critical",
  "freshness_status": "fresh",
  "summary": "Google Cloud IoT Core was discontinued on August 16, 2023 and is no longer an active Google Cloud service.",
  "current_state": "The service is discontinued. No single universal Google-operated replacement is asserted by this record.",
  "affected_surface": ["api_version"],
  "affected_users": ["developers", "iot_operators", "api_integrators"],
  "official_url": "https://cloud.google.com/terms/services/index-20230607",
  "docs_url": "https://cloud.google.com/terms/services/index-20230607",
  "migration_url": null,
  "replacement": null,
  "replacement_type": "none",
  "replacement_url": null,
  "source_status": "official",
  "confidence": "high",
  "announced_at": null,
  "deprecated_at": null,
  "sunset_at": "2023-08-16",
  "last_supported_at": "2023-08-16",
  "removal_effective_at": "2023-08-16",
  "migration_deadline_at": "2023-08-16",
  "first_seen_at": "2026-06-08",
  "last_checked_at": "2026-08-20",
  "next_check_recommended_at": null,
  "known_unknowns": ["This record does not assert one universal replacement because Google Cloud's public material points customers toward multiple partner or custom architectures."],
  "related_records": [],
  "notes": "Canonical backfill uses an official Google Cloud service-summary source that states the discontinuation date."
}