{
  "id": "apidep_entity_000013",
  "slug": "paypal-nvp-soap-apis",
  "canonical_name": "PayPal NVP/SOAP APIs",
  "aliases": ["PayPal NVP APIs", "PayPal SOAP APIs"],
  "provider": "PayPal",
  "provider_id": null,
  "category": "payment_commerce_api",
  "record_unit": "api_group",
  "status": "deprecated",
  "deprecation_stage": "deprecated",
  "deadline_status": "no_deadline",
  "still_usable": "yes",
  "still_usable_note": "Current PayPal developer documentation labels NVP/SOAP as legacy/deprecated but explicitly says PayPal continues to support these APIs and accepts new integrations.",
  "action_required": "migrate",
  "impact_level": "medium",
  "production_risk": "medium",
  "freshness_status": "fresh",
  "summary": "PayPal NVP/SOAP APIs are legacy/deprecated integration methods that remain supported. PayPal recommends current tools for new integrations and its upgrade path for existing integrations.",
  "current_state": "Supported legacy APIs with no shutdown date asserted by the current official documentation reviewed for this record.",
  "affected_surface": ["api_version"],
  "affected_users": ["developers", "payment_integrators"],
  "official_url": "https://developer.paypal.com/api/nvp-soap/",
  "docs_url": "https://developer.paypal.com/api/nvp-soap/",
  "migration_url": "https://developer.paypal.com/api/nvp-soap/",
  "replacement": "PayPal current APIs and latest integration tools",
  "replacement_type": "recommended",
  "replacement_url": "https://developer.paypal.com/api/nvp-soap/",
  "source_status": "official",
  "confidence": "high",
  "announced_at": null,
  "deprecated_at": null,
  "sunset_at": null,
  "last_supported_at": null,
  "removal_effective_at": null,
  "migration_deadline_at": null,
  "first_seen_at": "2026-06-08",
  "last_checked_at": "2026-08-20",
  "next_check_recommended_at": null,
  "known_unknowns": ["The exact original deprecation announcement date was not recovered in this review; no shutdown deadline is stated in the current official NVP/SOAP documentation."],
  "related_records": [],
  "notes": "No dated lifecycle event is added until a primary source establishes an event date."
}