{
  "id": "apidep_entity_000003",
  "slug": "slack-files-upload",
  "canonical_name": "Slack files.upload API method",
  "aliases": ["files.upload"],
  "provider": "Slack",
  "provider_id": "apidep_provider_000003",
  "category": "social_platform_api",
  "record_unit": "api_group",
  "status": "removed",
  "deprecation_stage": "removed",
  "deadline_status": "passed_removed",
  "still_usable": "no",
  "still_usable_note": "Current official Slack method documentation states files.upload stopped functioning and was sunset on November 12, 2025.",
  "action_required": "replace_endpoint",
  "impact_level": "high",
  "production_risk": "critical",
  "freshness_status": "fresh",
  "summary": "Slack files.upload is a removed API method with an official replacement upload flow.",
  "current_state": "Removed after the November 12, 2025 sunset according to current Slack developer documentation.",
  "affected_surface": ["endpoint"],
  "affected_users": ["developers", "api_integrators"],
  "official_url": "https://docs.slack.dev/reference/methods/files.upload/",
  "docs_url": "https://docs.slack.dev/reference/methods/files.upload/",
  "migration_url": "https://docs.slack.dev/changelog/2024-04-a-better-way-to-upload-files-is-here-to-stay/",
  "replacement": "files.getUploadURLExternal + files.completeUploadExternal",
  "replacement_type": "official",
  "replacement_url": "https://docs.slack.dev/changelog/2024-04-a-better-way-to-upload-files-is-here-to-stay/",
  "source_status": "official",
  "confidence": "high",
  "announced_at": "2024-04-09",
  "deprecated_at": "2024-05-16",
  "sunset_at": "2025-11-12",
  "last_supported_at": "2025-11-12",
  "removal_effective_at": "2025-11-12",
  "migration_deadline_at": "2025-11-12",
  "first_seen_at": "2026-06-05",
  "last_checked_at": "2026-08-20",
  "next_check_recommended_at": "2027-02-20",
  "known_unknowns": [],
  "related_records": [],
  "notes": "Stage 7 first-party follow-up advanced the record from deprecated/partial to removed after official sunset confirmation."
}
