{
  "id": "apidep_entity_000002",
  "slug": "firebase-dynamic-links",
  "canonical_name": "Firebase Dynamic Links",
  "aliases": [],
  "provider": "Firebase",
  "provider_id": "apidep_provider_000002",
  "category": "cloud_hosting_api",
  "record_unit": "developer_feature",
  "status": "removed",
  "deprecation_stage": "removed",
  "deadline_status": "passed_removed",
  "still_usable": "no",
  "still_usable_note": "Official FAQ states Firebase Dynamic Links shut down on August 25, 2025.",
  "action_required": "migrate",
  "impact_level": "high",
  "production_risk": "critical",
  "freshness_status": "fresh",
  "summary": "Firebase Dynamic Links is tracked as a removed developer feature with official shutdown notice.",
  "current_state": "Removed according to the official FAQ.",
  "affected_surface": ["endpoint", "sdk"],
  "affected_users": ["developers", "api_integrators"],
  "official_url": "https://firebase.google.com/support/dynamic-links-faq",
  "docs_url": "https://firebase.google.com/support/dynamic-links-faq",
  "migration_url": "https://firebase.google.com/support/dynamic-links-faq",
  "replacement": null,
  "replacement_type": "partial",
  "replacement_url": "https://firebase.google.com/support/dynamic-links-faq",
  "source_status": "official",
  "confidence": "high",
  "announced_at": null,
  "deprecated_at": null,
  "sunset_at": "2025-08-25",
  "last_supported_at": "2025-08-25",
  "removal_effective_at": "2025-08-25",
  "migration_deadline_at": "2025-08-25",
  "first_seen_at": "2026-06-05",
  "last_checked_at": "2026-08-20",
  "next_check_recommended_at": "2027-02-20",
  "known_unknowns": [],
  "related_records": [],
  "notes": "Stage 7 first-party follow-up reconfirmed shutdown state on 2026-08-20."
}
