{
  "id": "apidep_entity_000007",
  "slug": "github-password-authentication-for-git",
  "canonical_name": "GitHub password authentication for Git operations",
  "aliases": ["Git password authentication on GitHub.com"],
  "provider": "GitHub",
  "provider_id": null,
  "category": "developer_tool_api",
  "record_unit": "auth_method",
  "status": "removed",
  "deprecation_stage": "removed",
  "deadline_status": "passed_removed",
  "still_usable": "no",
  "still_usable_note": "GitHub stopped accepting account passwords for authenticated Git operations on GitHub.com on August 13, 2021.",
  "action_required": "rotate_auth",
  "impact_level": "high",
  "production_risk": "critical",
  "freshness_status": "fresh",
  "summary": "GitHub removed account-password authentication for authenticated Git operations and requires token-based authentication or SSH instead.",
  "current_state": "Account passwords are no longer accepted for authenticated Git operations on GitHub.com.",
  "affected_surface": ["auth"],
  "affected_users": ["developers", "api_integrators"],
  "official_url": "https://github.blog/changelog/2021-08-12-git-password-authentication-is-shutting-down/",
  "docs_url": "https://github.blog/changelog/2021-08-12-git-password-authentication-is-shutting-down/",
  "migration_url": "https://github.blog/changelog/2021-08-12-git-password-authentication-is-shutting-down/",
  "replacement": "Token-based authentication or SSH",
  "replacement_type": "official",
  "replacement_url": "https://github.blog/changelog/2021-08-12-git-password-authentication-is-shutting-down/",
  "source_status": "official",
  "confidence": "high",
  "announced_at": "2021-08-12",
  "deprecated_at": null,
  "sunset_at": "2021-08-13",
  "last_supported_at": "2021-08-13",
  "removal_effective_at": "2021-08-13",
  "migration_deadline_at": "2021-08-13",
  "first_seen_at": "2026-06-07",
  "last_checked_at": "2026-08-19",
  "next_check_recommended_at": null,
  "known_unknowns": [],
  "related_records": [],
  "notes": "Canonical backfill from GitHub's removal announcement."
}