{
  "id": "apidep_entity_000017",
  "slug": "apple-apns-binary-provider-api",
  "canonical_name": "Apple APNs legacy binary provider API",
  "aliases": ["APNs binary interface", "APNs legacy binary protocol"],
  "provider": "Apple",
  "provider_id": null,
  "category": "developer_tool_api",
  "record_unit": "api_group",
  "status": "removed",
  "deprecation_stage": "removed",
  "deadline_status": "passed_removed",
  "still_usable": "no",
  "still_usable_note": "Apple states that APNs no longer supports the legacy binary protocol after March 31, 2021.",
  "action_required": "migrate",
  "impact_level": "high",
  "production_risk": "critical",
  "freshness_status": "fresh",
  "summary": "Apple ended support for the legacy APNs binary provider protocol after March 31, 2021 and requires the HTTP/2-based APNs provider API.",
  "current_state": "Removed legacy provider interface; push providers must use the HTTP/2-based APNs provider API.",
  "affected_surface": ["endpoint"],
  "affected_users": ["developers", "push_notification_operators"],
  "official_url": "https://developer.apple.com/news/?id=c88acm2b",
  "docs_url": "https://developer.apple.com/news/upcoming-requirements/?id=03312021a",
  "migration_url": "https://developer.apple.com/documentation/usernotifications/sending-notification-requests-to-apns",
  "replacement": "HTTP/2-based APNs provider API",
  "replacement_type": "official",
  "replacement_url": "https://developer.apple.com/documentation/usernotifications/sending-notification-requests-to-apns",
  "source_status": "official",
  "confidence": "high",
  "announced_at": "2020-10-09",
  "deprecated_at": null,
  "sunset_at": "2021-03-31",
  "last_supported_at": "2021-03-31",
  "removal_effective_at": "2021-03-31",
  "migration_deadline_at": "2021-03-31",
  "first_seen_at": "2026-06-08",
  "last_checked_at": "2026-08-20",
  "next_check_recommended_at": null,
  "known_unknowns": [],
  "related_records": [],
  "notes": "Apple first announced an earlier deadline and later extended it to March 31, 2021; this record uses the final official boundary."
}