{
  "id": "apidep_entity_000004",
  "slug": "shopify-rest-admin-api",
  "canonical_name": "Shopify REST Admin API",
  "aliases": ["REST Admin API"],
  "provider": "Shopify",
  "provider_id": "apidep_provider_000004",
  "category": "payment_commerce_api",
  "record_unit": "api_group",
  "status": "deprecated",
  "deprecation_stage": "deprecated",
  "deadline_status": "passed_unverified",
  "still_usable": "partial",
  "still_usable_note": "Official documentation describes REST Admin API as legacy and gives GraphQL Admin API as the preferred path.",
  "action_required": "migrate",
  "impact_level": "high",
  "production_risk": "high",
  "freshness_status": "fresh",
  "summary": "Shopify REST Admin API is tracked as a legacy commerce API surface with migration guidance to GraphQL Admin API.",
  "current_state": "Legacy API surface according to official documentation.",
  "affected_surface": ["api_version"],
  "affected_users": ["developers", "api_integrators"],
  "official_url": "https://shopify.dev/docs/api/admin-rest",
  "docs_url": "https://shopify.dev/docs/api/admin-rest",
  "migration_url": "https://shopify.dev/docs/api/admin-rest",
  "replacement": "GraphQL Admin API",
  "replacement_type": "official",
  "replacement_url": "https://shopify.dev/docs/api/admin-rest",
  "source_status": "official",
  "confidence": "high",
  "announced_at": null,
  "deprecated_at": "2024-10-01",
  "sunset_at": null,
  "last_supported_at": null,
  "removal_effective_at": null,
  "migration_deadline_at": "2025-04-01",
  "first_seen_at": "2026-06-05",
  "last_checked_at": "2026-08-20",
  "next_check_recommended_at": "2026-11-20",
  "known_unknowns": ["The record tracks legacy status and migration guidance, not complete removal of every REST surface."],
  "related_records": [],
  "notes": "Stage 7 first-party follow-up reconfirmed legacy status and GraphQL migration guidance on 2026-08-20."
}
