{
  "id": "apidep_entity_000008",
  "slug": "heroku-free-product-plans",
  "canonical_name": "Heroku free product plans",
  "aliases": ["Heroku free dynos and data plans"],
  "provider": "Heroku",
  "provider_id": null,
  "category": "cloud_hosting_api",
  "record_unit": "pricing_or_limit_change",
  "status": "removed",
  "deprecation_stage": "removed",
  "deadline_status": "passed_removed",
  "still_usable": "no",
  "still_usable_note": "Heroku ended the affected free dyno, Postgres, and Key-Value Store plans starting November 28, 2022.",
  "action_required": "migrate",
  "impact_level": "high",
  "production_risk": "high",
  "freshness_status": "fresh",
  "summary": "Heroku removed its affected free product plans starting November 28, 2022 and directed users to paid replacement plans.",
  "current_state": "The tracked free plans are no longer available. Existing users had to move to paid resources to avoid app disruption or data loss.",
  "affected_surface": ["pricing"],
  "affected_users": ["developers", "app_operators"],
  "official_url": "https://help.heroku.com/RSBRUH58/removal-of-heroku-free-product-plans-faq",
  "docs_url": "https://help.heroku.com/RSBRUH58/removal-of-heroku-free-product-plans-faq",
  "migration_url": "https://help.heroku.com/RSBRUH58/removal-of-heroku-free-product-plans-faq",
  "replacement": "Heroku Eco, Mini, or other paid plans",
  "replacement_type": "official",
  "replacement_url": "https://help.heroku.com/RSBRUH58/removal-of-heroku-free-product-plans-faq",
  "source_status": "official",
  "confidence": "high",
  "announced_at": null,
  "deprecated_at": null,
  "sunset_at": "2022-11-28",
  "last_supported_at": "2022-11-28",
  "removal_effective_at": "2022-11-28",
  "migration_deadline_at": "2022-11-28",
  "first_seen_at": "2026-06-07",
  "last_checked_at": "2026-08-19",
  "next_check_recommended_at": null,
  "known_unknowns": [],
  "related_records": [],
  "notes": "Canonical backfill from current first-party Heroku help documentation."
}