{
  "id": "apidep_entity_000015",
  "slug": "twilio-authy-api",
  "canonical_name": "Twilio Authy API",
  "aliases": ["Authy API", "Twilio Authy"],
  "provider": "Twilio",
  "provider_id": null,
  "category": "developer_tool_api",
  "record_unit": "api_group",
  "status": "limited",
  "deprecation_stage": "announced",
  "deadline_status": "unknown",
  "still_usable": "partial",
  "still_usable_note": "Twilio says the Authy API is closed to new customers; qualifying existing TOTP/Push customers remain supported until End of Life, which is not assigned an exact date in the reviewed documentation.",
  "action_required": "migrate",
  "impact_level": "high",
  "production_risk": "high",
  "freshness_status": "fresh",
  "summary": "Twilio Authy API is closed to new customers and planned for future full deprecation. Existing qualifying customers remain supported for now, with Twilio Verify v2 recommended for new development.",
  "current_state": "Limited to eligible existing customers; no exact End-of-Life date is asserted by the current reviewed Twilio documentation.",
  "affected_surface": ["api_version", "auth"],
  "affected_users": ["developers", "authentication_integrators"],
  "official_url": "https://www.twilio.com/docs/authy/quickstart",
  "docs_url": "https://www.twilio.com/docs/authy/quickstart",
  "migration_url": "https://www.twilio.com/docs/authy/quickstart",
  "replacement": "Twilio Verify v2 API",
  "replacement_type": "official",
  "replacement_url": "https://www.twilio.com/docs/verify/api",
  "source_status": "official",
  "confidence": "high",
  "announced_at": null,
  "deprecated_at": null,
  "sunset_at": null,
  "last_supported_at": null,
  "removal_effective_at": null,
  "migration_deadline_at": null,
  "first_seen_at": "2026-06-08",
  "last_checked_at": "2026-08-20",
  "next_check_recommended_at": "2026-11-20",
  "known_unknowns": ["Twilio's reviewed documentation does not provide an exact full-deprecation or End-of-Life date."],
  "related_records": [],
  "notes": "Corrects the older display state that implied a dated upcoming shutdown."
}