{
  "id": "apidep_entity_000005",
  "slug": "kubernetes-v1-22-removed-apis",
  "canonical_name": "Kubernetes v1.22 Removed APIs",
  "aliases": ["Kubernetes 1.22 Deprecated APIs"],
  "provider": "Kubernetes",
  "provider_id": "apidep_provider_000005",
  "category": "developer_tool_api",
  "record_unit": "api_version",
  "status": "removed",
  "deprecation_stage": "removed",
  "deadline_status": "passed_removed",
  "still_usable": "no",
  "still_usable_note": "Official Kubernetes documentation lists deprecated APIs no longer served in v1.22.",
  "action_required": "migrate",
  "impact_level": "high",
  "production_risk": "critical",
  "freshness_status": "fresh",
  "summary": "Kubernetes v1.22 removed several deprecated API versions and requires migration to supported versions.",
  "current_state": "Removed in Kubernetes v1.22 according to official documentation.",
  "affected_surface": ["api_version"],
  "affected_users": ["developers", "api_integrators", "cluster_operators"],
  "official_url": "https://kubernetes.io/docs/reference/using-api/deprecation-guide/",
  "docs_url": "https://kubernetes.io/docs/reference/using-api/deprecation-guide/",
  "migration_url": "https://kubernetes.io/docs/reference/using-api/deprecation-guide/",
  "replacement": "supported Kubernetes API versions listed in the migration guide",
  "replacement_type": "official",
  "replacement_url": "https://kubernetes.io/docs/reference/using-api/deprecation-guide/",
  "source_status": "official",
  "confidence": "high",
  "announced_at": null,
  "deprecated_at": null,
  "sunset_at": "2021-08-04",
  "last_supported_at": "2021-08-04",
  "removal_effective_at": "2021-08-04",
  "migration_deadline_at": "2021-08-04",
  "first_seen_at": "2026-06-05",
  "last_checked_at": "2026-08-20",
  "next_check_recommended_at": "2027-02-20",
  "known_unknowns": [],
  "related_records": [],
  "notes": "Stage 7 first-party follow-up reconfirmed the v1.22 removed-API migration guidance on 2026-08-20."
}
