{
  "id": "apidep_entity_000020",
  "slug": "stripe-sources-api",
  "canonical_name": "Stripe Sources API",
  "aliases": ["Sources API"],
  "provider": "Stripe",
  "provider_id": null,
  "category": "payment_commerce_api",
  "record_unit": "api_group",
  "status": "limited",
  "deprecation_stage": "deprecated",
  "deadline_status": "unknown",
  "still_usable": "partial",
  "still_usable_note": "Stripe has deprecated the Sources API. Support for local payment methods is planned to be turned off, while Stripe currently says it does not plan to turn off Sources support for card payments.",
  "action_required": "migrate",
  "impact_level": "high",
  "production_risk": "high",
  "freshness_status": "fresh",
  "summary": "Stripe Sources is a deprecated payment API with scope-dependent availability. Stripe recommends Payment Methods/Payment Intents and plans to remove local-payment-method support while retaining card support for now.",
  "current_state": "Deprecated and limited rather than universally removed; migration urgency depends on the payment-method scope used by the integration.",
  "affected_surface": ["api_version"],
  "affected_users": ["developers", "payment_integrators"],
  "official_url": "https://docs.stripe.com/payments/older-apis",
  "docs_url": "https://docs.stripe.com/api/sources",
  "migration_url": "https://docs.stripe.com/payments/payment-methods/transitioning",
  "replacement": "Payment Methods and Payment Intents APIs",
  "replacement_type": "official",
  "replacement_url": "https://docs.stripe.com/payments/payment-methods/transitioning",
  "source_status": "official",
  "confidence": "high",
  "announced_at": null,
  "deprecated_at": null,
  "sunset_at": null,
  "last_supported_at": null,
  "removal_effective_at": null,
  "migration_deadline_at": null,
  "first_seen_at": "2026-06-08",
  "last_checked_at": "2026-08-20",
  "next_check_recommended_at": "2026-11-20",
  "known_unknowns": ["Stripe's public documentation reviewed here does not state one universal Sources API shutdown date; local-payment-method and card-payment support have different lifecycle states."],
  "related_records": [],
  "notes": "No dated canonical event is created until a first-party announcement date or support-off date is established for a concrete Sources API scope."
}