{
  "id": "apidep_entity_000009",
  "slug": "google-url-shortener-goo-gl-links",
  "canonical_name": "Google URL Shortener goo.gl links",
  "aliases": ["goo.gl links", "Google URL Shortener links"],
  "provider": "Google",
  "provider_id": null,
  "category": "cloud_hosting_api",
  "record_unit": "developer_feature",
  "status": "limited",
  "deprecation_stage": "deprecated",
  "deadline_status": "no_deadline",
  "still_usable": "partial",
  "still_usable_note": "Google revised its earlier universal shutdown plan: only links that showed no activity in late 2024 and received the deactivation interstitial were targeted for deactivation after August 25, 2025; other goo.gl links continue to function.",
  "action_required": "migrate",
  "impact_level": "high",
  "production_risk": "high",
  "freshness_status": "fresh",
  "summary": "Google no longer treats all goo.gl links as universally shutting down. A defined inactive subset was targeted for deactivation, while other existing goo.gl links remain supported.",
  "current_state": "Link behavior is scope-dependent: targeted inactive links no longer work after the 2025 boundary, while other goo.gl links continue functioning.",
  "affected_surface": ["docs"],
  "affected_users": ["developers", "site_operators", "content_publishers"],
  "official_url": "https://developers.googleblog.com/google-url-shortener-links-will-no-longer-be-available/",
  "docs_url": "https://developers.googleblog.com/google-url-shortener-links-will-no-longer-be-available/",
  "migration_url": "https://developers.googleblog.com/google-url-shortener-links-will-no-longer-be-available/",
  "replacement": null,
  "replacement_type": "none",
  "replacement_url": null,
  "source_status": "official",
  "confidence": "high",
  "announced_at": "2024-07-18",
  "deprecated_at": null,
  "sunset_at": null,
  "last_supported_at": null,
  "removal_effective_at": null,
  "migration_deadline_at": null,
  "first_seen_at": "2026-06-07",
  "last_checked_at": "2026-08-20",
  "next_check_recommended_at": null,
  "known_unknowns": ["Whether a particular goo.gl URL is disabled depends on the link-specific activity/deactivation condition described by Google."],
  "related_records": [],
  "notes": "Corrects the older display assumption that all goo.gl links would stop working."
}